### ISSUE TITLE
Linux client second request runs into E0 TIMEOUT on Raspbian

### ISSUE THREAD

**Issue by Miq1** [eModbus/eModbus#197]
**Describe the bug**
A sample client application running smoothly on Lubuntu 20.04 focal that does two consecutive requests to the same TCP server will run into an E0 TIMEOUT error response when built on Raspbian 10 Buster.

**Expected behavior**
The second request shall be executed as the first.

**Comment by Miq1** [comment]
Sample ``tcpdump`` output on Raspbian:
```
17:36:38.298862 IP Pinsel.fritz.box.47796 > Pool.fritz.box.502: Flags [.], ack 1, win 64240, length 0
17:36:38.300269 IP Pinsel.fritz.box.47796 > Pool.fritz.box.502: Flags [P.], seq 1:13, ack 1, win 64240, length 12 --- request 1
17:36:38.572329 IP Pool.fritz.box.502 > Pinsel.fritz.box.47796: Flags [.], ack 13, win 5828, length 0
17:36:38.572386 IP Pool.fritz.box.502 > Pinsel.fritz.box.47796: Flags [P.], seq 1:26, ack 13, win 5828, length 25 --- response 1
17:36:38.572424 IP Pinsel.fritz.box.47796 > Pool.fritz.box.502: Flags [.], ack 26, win 64215, length 0
17:36:41.122528 IP Pool.fritz.box.502 > Pinsel.fritz.box.47796: Flags [F.], seq 26, ack 13, win 5828, length 0
17:36:41.167003 IP Pinsel.fritz.box.47796 > Pool.fritz.box.502: Flags [.], ack 27, win 64214, length 0
17:37:38.590450 IP Pinsel.fritz.box.47796 > Pool.fritz.box.502: Flags [F.], seq 13, ack 27, win 64214, length 0
17:37:38.602123 IP Pool.fritz.box.502 > Pinsel.fritz.box.47796: Flags [R.], seq 27, ack 14, win 53270, length 0
```
Same on Lubuntu:
```
17:41:06.823628 IP LinuxBox.fritz.box.48874 > Pool.fritz.box.502: Flags [.], ack 1, win 64240, length 0
17:41:06.824990 IP LinuxBox.fritz.box.48874 > Pool.fritz.box.502: Flags [P.], seq 1:13, ack 1, win 64240, length 12 --- request 1
17:41:07.075037 IP Pool.fritz.box.502 > LinuxBox.fritz.box.48874: Flags [.], ack 13, win 5828, length 0
17:41:07.352804 IP Pool.fritz.box.502 > LinuxBox.fritz.box.48874: Flags [P.], seq 1:26, ack 13, win 5828, length 25 --- response 1
17:41:07.352833 IP LinuxBox.fritz.box.48874 > Pool.fritz.box.502: Flags [.], ack 26, win 64215, length 0
17:41:07.554933 IP LinuxBox.fritz.box.48874 > Pool.fritz.box.502: Flags [P.], seq 13:25, ack 26, win 64215, length 12 --- request 2
17:41:07.624620 IP Pool.fritz.box.502 > LinuxBox.fritz.box.48874: Flags [.], ack 25, win 5816, length 0
17:41:07.897139 IP Pool.fritz.box.502 > LinuxBox.fritz.box.48874: Flags [P.], seq 26:63, ack 25, win 5816, length 37 --- response 2
17:41:07.897163 IP LinuxBox.fritz.box.48874 > Pool.fritz.box.502: Flags [.], ack 63, win 64178, length 0
17:41:07.899633 IP LinuxBox.fritz.box.48874 > Pool.fritz.box.502: Flags [F.], seq 25, ack 63, win 64178, length 0
17:41:07.912455 IP Pool.fritz.box.502 > LinuxBox.fritz.box.48874: Flags [F.], seq 63, ack 26, win 5815, length 0
17:41:07.912481 IP LinuxBox.fritz.box.48874 > Pool.fritz.box.502: Flags [.], ack 64, win 64177, length 0
```

**Comment by Miq1** [comment]
For comparison the output of the lubuntu client:
```
micha@LinuxBox:~/MBCLinux$ ./Smartdose pool
[D] 10968300| Client.cpp           [ 236] hostname_to_ip: Looking for 'pool'
[D] 10968304| Client.cpp           [ 254] hostname_to_ip: Host 'pool'=192.168.178.51
Using 192.168.178.51:502:1
[D] 10968304| ModbusClientTCP.cpp  [  69] begin: TCP client worker started.
[D] 10968304| ModbusClientTCP.cpp  [  95] setTarget: Target set: 192.168.178.51:502
[V] 10968304| ModbusMessage.cpp    [ 529] checkData: Check data #3
[D] 10968304| ModbusClientTCP.cpp  [ 180] addToQueue: Queue size: 0
[V] Enqueue: @561DFADA57A0/6:
  | 0000: 01 03 00 01 00 08                                 |......          |
[D] 10968304| ModbusClientTCP.cpp  [ 213] handleConnection: Got request from queue
[D] 10968304| Client.cpp           [ 210] connected: returns 0 (r=0, errno=9, Bad file descriptor)
[D] 10968305| Client.cpp           [ 210] connected: returns 0 (r=0, errno=9, Bad file descriptor)
[D] 10968305| Client.cpp           [ 210] connected: returns 0 (r=0, errno=9, Bad file descriptor)
[D] 10968427| Client.cpp           [  59] connect: Connected.
[D] 10968427| ModbusClientTCP.cpp  [ 238] handleConnection: Target connect (192.168.178.51:502).
[D] 10968428| Client.cpp           [ 210] connected: returns 1 (r=-1, errno=11, Resource temporarily unavailable)
[D] 10968428| ModbusClientTCP.cpp  [ 244] handleConnection: Is connected. Send request.
[D] 10968428| Client.cpp           [ 119] write: send buffer[12] -> 12
[V] Request packet: @7FE998000B60/12:
  | 0000: 00 00 00 00 00 06 01 03  00 01 00 08              |............    |
[D] 10968948| ModbusClientTCP.cpp  [ 380] receive: Received response.
[V] Response packet: @7FE99E7B1CB0/25:
  | 0000: 00 00 00 00 00 13 01 03  10 00 FF A0 01 00 7B 2C  |..............{,|
  | 0010: 1E 00 02 0C 0A 00 33 29  37                       |......3)7       |
[D] 10968949| ModbusClientTCP.cpp  [ 253] handleConnection: Data response.
[D] 10968949| ModbusClientTCP.cpp  [ 330] handleConnection: Request popped from queue.
Gosund device Modbus server Default: ON
Running since  123:44:30
ON time         51:41:55
ON  (255) for    2:12:10
[V] 10968956| ModbusMessage.cpp    [ 529] checkData: Check data #3
[D] 10968956| ModbusClientTCP.cpp  [ 180] addToQueue: Queue size: 0
[V] Enqueue: @7FE998000B60/6:
  | 0000: 01 03 00 09 00 0E                                 |......          |
[D] 10968956| ModbusClientTCP.cpp  [ 213] handleConnection: Got request from queue
[D] 10968956| Client.cpp           [ 210] connected: returns 1 (r=-1, errno=11, Resource temporarily unavailable)
[D] 10968957| Client.cpp           [ 210] connected: returns 1 (r=-1, errno=11, Resource temporarily unavailable)
[D] 10969149| Client.cpp           [ 210] connected: returns 1 (r=-1, errno=11, Resource temporarily unavailable)
[D] 10969149| Client.cpp           [ 210] connected: returns 1 (r=-1, errno=11, Resource temporarily unavailable)
[D] 10969149| ModbusClientTCP.cpp  [ 244] handleConnection: Is connected. Send request.
[D] 10969149| Client.cpp           [ 119] write: send buffer[12] -> 12
[V] Request packet: @561DFADA5760/12:
  | 0000: 00 01 00 00 00 06 01 03  00 09 00 0E              |............    |
[D] 10969500| ModbusClientTCP.cpp  [ 380] receive: Received response.
[V] Response packet: @7FE99E7B1CB0/37:
  | 0000: 00 01 00 00 00 1F 01 03  1C 45 86 82 B7 3F 82 D0  |.........E...?..|
  | 0010: E5 3F 8C CC CD 3F 85 1E  B8 43 69 1D D7 3E D9 74  |.?...?...Ci..>.t|
  | 0020: 00 42 A8 7D BF                                    |.B.}.           |
[D] 10969500| ModbusClientTCP.cpp  [ 253] handleConnection: Data response.
[D] 10969500| ModbusClientTCP.cpp  [ 330] handleConnection: Request popped from queue.
[V] floatOrder: @561DFA0AF480/4:
  | 0000: 03 02 01 00                                       |....            |
[V] got float: @561DFA0AF600/4:
  | 0000: B7 82 86 45                                       |...E            |
[V] got float swapped: @561DFA0AF600/4:
  | 0000: B7 82 86 45                                       |...E            |
[V] got float: @561DFA0AF604/4:
  | 0000: E5 D0 82 3F                                       |...?            |
[V] got float swapped: @561DFA0AF604/4:
  | 0000: E5 D0 82 3F                                       |...?            |
[V] got float: @561DFA0AF608/4:
  | 0000: CD CC 8C 3F                                       |...?            |
[V] got float swapped: @561DFA0AF608/4:
  | 0000: CD CC 8C 3F                                       |...?            |
[V] got float: @561DFA0AF60C/4:
  | 0000: B8 1E 85 3F                                       |...?            |
[V] got float swapped: @561DFA0AF60C/4:
  | 0000: B8 1E 85 3F                                       |...?            |
[V] got float: @561DFA0AF614/4:
  | 0000: D7 1D 69 43                                       |..iC            |
[V] got float swapped: @561DFA0AF614/4:
  | 0000: D7 1D 69 43                                       |..iC            |
[V] got float: @561DFA0AF618/4:
  | 0000: 00 74 D9 3E                                       |.t.>            |
[V] got float swapped: @561DFA0AF618/4:
  | 0000: 00 74 D9 3E                                       |.t.>            |
[V] got float: @561DFA0AF610/4:
  | 0000: BF 7D A8 42                                       |.}.B            |
[V] got float swapped: @561DFA0AF610/4:
  | 0000: BF 7D A8 42                                       |.}.B            |
accumulated         4.30 kWh
Power              84.25 W
Voltage           233.12 V
Current             0.42 A
[D] 10969505| ModbusClientTCP.cpp  [  46] ~ModbusClientTCP: TCP client worker killed.
[D] 10969505| Client.cpp           [ 210] connected: returns 1 (r=-1, errno=11, Resource temporarily unavailable)
```

**Comment by Miq1** [comment]
Finally found it! 

In ``Client.cpp``, the ``read()`` for a single byte would have returned a zero if no data was available. In ``ModbusClientTCP.cpp``, the ``handleConnection()`` function was waiting for a -1 instead, thus looping forever (until timeout struck) in the attempt to clean up the read buffers.
